{
  "id": "amazon-alexa",
  "name": "Amazon Alexa",
  "company": "Amazon.com, Inc.",
  "category": "ai-assistant",
  "brandColor": "#00caff",
  "domains": ["alexa.amazon.com"],
  "summary": "Amazon uses your Alexa and Alexa+ interactions, including voice recordings, transcripts and typed requests, to train its models, with a small sample reviewed by people. You can limit the use of voice recordings.",
  "training": {
    "trainsOnUserData": "yes",
    "defaultState": "opted_in",
    "dataTypes": ["voice", "chats", "messages", "activity"],
    "details": "Amazon says it uses Alexa interactions (voice recordings, text transcripts, typed requests and other interactions) to improve Alexa and to train its machine-learning models, including supervised learning in which people review a very small sample of requests. It may also use Alexa interactions to improve other Amazon services, such as shopping search. The “Help improve Alexa” settings (use of voice recordings, and use of messages to improve transcriptions) are on by default. Turning them off limits how your voice recordings are used to develop features and be reviewed, but Amazon still keeps text transcripts and typed requests to improve its services. In March 2025 Amazon removed the on-device “Do Not Send Voice Recordings” option from the few Echo models that had it, so requests are processed in Amazon's cloud. Amazon says deleting your data does not remove it from systems already trained on it.",
    "retroactiveRemoval": false,
    "regionNotes": {
      "EU": "The same Alexa Privacy settings apply. You can also object to processing under GDPR through the privacy contact listed in your country's Amazon privacy notice.",
      "UK": "You can object to processing under UK GDPR through Amazon's EU privacy team (eu-privacy@amazon.co.uk)."
    }
  },
  "optOuts": [
    {
      "id": "help-improve-alexa",
      "type": "toggle",
      "title": "Turn off “Help improve Alexa” (use of voice recordings)",
      "description": "The Alexa Privacy settings that control whether your voice recordings and messages are used to improve Amazon's services.",
      "url": "https://www.amazon.com/alexaprivacysettings",
      "regions": ["ALL"],
      "effort": "quick",
      "steps": [
        "Open the Alexa app and go to More, then Alexa Privacy (or open the link on a computer; outside the US use your own country's Amazon site).",
        "Choose Manage Your Alexa Data.",
        "Under Help improve Alexa, turn off the use of voice recordings.",
        "Also turn off “Use messages to improve transcriptions” for each person listed."
      ],
      "effect": "Your future voice recordings are no longer used to develop new features or manually reviewed. Amazon may still use text transcripts and other interaction data to improve its services, and past training is not undone."
    },
    {
      "id": "dont-save-recordings",
      "type": "toggle",
      "title": "Choose not to save Alexa voice recordings",
      "description": "Deletes recordings after each request is processed, which limits what can be reused later.",
      "url": "https://www.amazon.com/alexaprivacysettings",
      "regions": ["ALL"],
      "effort": "quick",
      "steps": [
        "In Alexa Privacy, open Manage Your Alexa Data.",
        "In the voice recordings section, choose not to save recordings.",
        "Confirm. Existing recordings are deleted."
      ],
      "effect": "Voice recordings are deleted after Alexa processes each request, and existing ones are erased. Text transcripts and typed requests are still kept for 30 days and may be used to improve Amazon's services. Voice ID stops working."
    }
  ],
  "policyUrls": [
    "https://www.amazon.com/gp/help/customer/display.html?nodeId=GVP69FUJ48X9DK8V",
    "https://www.amazon.com/gp/help/customer/display.html?nodeId=GX7NJQ4ZB8MHFRNJ"
  ],
  "sources": [
    {
      "title": "Alexa, Echo Devices, and Your Privacy | Amazon Help",
      "url": "https://www.amazon.com/gp/help/customer/display.html?nodeId=GVP69FUJ48X9DK8V",
      "accessed": "2026-09-28"
    },
    {
      "title": "Amazon.com Privacy Notice",
      "url": "https://www.amazon.com/gp/help/customer/display.html?nodeId=GX7NJQ4ZB8MHFRNJ",
      "accessed": "2026-09-28"
    },
    {
      "title": "Alexa Privacy Settings | Amazon",
      "url": "https://www.amazon.com/alexaprivacysettings",
      "accessed": "2026-09-28"
    }
  ],
  "lastVerified": "2026-09-28",
  "policyVersion": 1,
  "changelog": [
    {
      "version": 1,
      "date": "2026-09-28",
      "summary": "Added to the NoTrain registry.",
      "severity": "info"
    }
  ]
}
